{
  "schemaVersion": "agent-eval-source-evidence-triangulation-fixture-1",
  "standardVersion": "0.1.0",
  "sources": [
    {
      "id": "SRC-FIXTURE-EMPIRICAL-A",
      "title": "Independent repository-agent study A",
      "authorsOrOrganization": [
        "Fixture Research Group A"
      ],
      "producerIds": [
        "ORG-FIXTURE-A"
      ],
      "publicationDate": "2026-01-01",
      "sourceType": "industry_report",
      "versionIdentity": {
        "kind": "edition",
        "value": "fixture-a-1"
      },
      "mutableLocator": null,
      "archive": {
        "status": "verified",
        "immutableLocator": "artifact:sha256:aaaaaaaaaaaaaaaaaaaaaaaaaaaaaaaaaaaaaaaaaaaaaaaaaaaaaaaaaaaaaaaa",
        "digest": "sha256:aaaaaaaaaaaaaaaaaaaaaaaaaaaaaaaaaaaaaaaaaaaaaaaaaaaaaaaaaaaaaaaa"
      },
      "retrievalDate": "2026-01-02",
      "evidenceClass": "primary_empirical_report",
      "empiricalRole": "primary_empirical_source",
      "limitations": [
        "Synthetic positive fixture; it tests evidence semantics and makes no real-world claim."
      ],
      "population": "Repository-agent task population A",
      "fundingDisclosure": {
        "status": "verified_from_archived_source",
        "sponsorIds": [],
        "basis": "The archived source states that the study received no external funding.",
        "evidence": {
          "archiveDigest": "sha256:aaaaaaaaaaaaaaaaaaaaaaaaaaaaaaaaaaaaaaaaaaaaaaaaaaaaaaaaaaaaaaaa",
          "location": "Funding disclosure, paragraph 1",
          "statement": "No external funding."
        }
      },
      "contraryEvidence": []
    },
    {
      "id": "SRC-FIXTURE-EMPIRICAL-B",
      "title": "Independent repository-agent study B",
      "authorsOrOrganization": [
        "Fixture Research Group B"
      ],
      "producerIds": [
        "ORG-FIXTURE-B"
      ],
      "publicationDate": "2026-02-01",
      "sourceType": "paper",
      "versionIdentity": {
        "kind": "doi",
        "value": "10.0000/fixture-b"
      },
      "mutableLocator": null,
      "archive": {
        "status": "verified",
        "immutableLocator": "artifact:sha256:bbbbbbbbbbbbbbbbbbbbbbbbbbbbbbbbbbbbbbbbbbbbbbbbbbbbbbbbbbbbbbbb",
        "digest": "sha256:bbbbbbbbbbbbbbbbbbbbbbbbbbbbbbbbbbbbbbbbbbbbbbbbbbbbbbbbbbbbbbbb"
      },
      "retrievalDate": "2026-02-02",
      "evidenceClass": "peer_reviewed_research",
      "empiricalRole": "primary_empirical_source",
      "limitations": [
        "Synthetic positive fixture; it tests evidence semantics and makes no real-world claim."
      ],
      "population": "Repository-agent task population B",
      "fundingDisclosure": {
        "status": "verified_from_archived_source",
        "sponsorIds": [],
        "basis": "The archived source states that the study received no external funding.",
        "evidence": {
          "archiveDigest": "sha256:bbbbbbbbbbbbbbbbbbbbbbbbbbbbbbbbbbbbbbbbbbbbbbbbbbbbbbbbbbbbbbbb",
          "location": "Acknowledgements, paragraph 2",
          "statement": "No external funding."
        }
      },
      "contraryEvidence": []
    }
  ],
  "observations": [
    {
      "id": "OBS-FIXTURE-A",
      "sourceId": "SRC-FIXTURE-EMPIRICAL-A",
      "role": "primary_empirical_observation",
      "population": "Repository-agent task population A",
      "sampling": "A predeclared sample from organization A's independent repository-task frame.",
      "method": "Replay-based assessment by evaluator A.",
      "result": "The bounded fixture mechanism was observed under study A's declared conditions.",
      "uncertaintyAndSelectionConditions": [
        "Inference is limited to study A's sampled frame."
      ],
      "limits": [
        "Synthetic conformance datum; no external empirical conclusion is implied."
      ],
      "dataOrBenchmarkLineageIds": [
        "LINEAGE-FIXTURE-A"
      ]
    },
    {
      "id": "OBS-FIXTURE-B",
      "sourceId": "SRC-FIXTURE-EMPIRICAL-B",
      "role": "primary_empirical_observation",
      "population": "Repository-agent task population B",
      "sampling": "A predeclared sample from organization B's independent repository-task frame.",
      "method": "Artifact-review assessment by evaluator B.",
      "result": "The bounded fixture mechanism was observed under study B's declared conditions.",
      "uncertaintyAndSelectionConditions": [
        "Inference is limited to study B's sampled frame."
      ],
      "limits": [
        "Synthetic conformance datum; no external empirical conclusion is implied."
      ],
      "dataOrBenchmarkLineageIds": [
        "LINEAGE-FIXTURE-B"
      ]
    }
  ],
  "claim": {
    "requirementId": "FIXTURE-TRI-001",
    "kind": "source_evidence",
    "sourceIds": [
      "SRC-FIXTURE-EMPIRICAL-A",
      "SRC-FIXTURE-EMPIRICAL-B"
    ],
    "observationIds": [
      "OBS-FIXTURE-A",
      "OBS-FIXTURE-B"
    ],
    "representedPopulation": "The union of the two explicitly bounded synthetic repository-agent study populations.",
    "support": "triangulated_empirical",
    "supportedClaims": [
      "Two independently produced synthetic observations report the same bounded fixture mechanism."
    ],
    "limitations": [
      "This fixture validates manifest semantics only and is not real empirical evidence."
    ],
    "independenceAssessment": {
      "observationIds": [
        "OBS-FIXTURE-A",
        "OBS-FIXTURE-B"
      ],
      "producerIds": [
        "ORG-FIXTURE-A",
        "ORG-FIXTURE-B"
      ],
      "sharedAuthorNames": [],
      "sharedDataOrBenchmarkLineageIds": [],
      "identicalPopulationStatements": [],
      "populationOverlapAssessment": "The two sampling frames are separately produced; the represented population is their explicit union.",
      "identicalMethodStatements": [],
      "methodOverlapAssessment": "The studies use different evaluator methods and disclose their distinct method statements.",
      "sharedSponsorIds": [],
      "commonModeAssessment": "No shared producer, author name, benchmark lineage, or sponsor is present in the synthetic fixture; remaining conceptual overlap is explicit in the bounded claim.",
      "conclusion": "sufficiently_independent_for_the_bounded_claim"
    }
  }
}
